{
    "accessors": [
        {
            "bufferView": 0,
            "componentType": 5126,
            "count": 555,
            "max": [
                1.3671875,
                0.984375,
                0.8515625
            ],
            "min": [
                -1.3671875,
                -0.984375,
                -0.8515625
            ],
            "type": "VEC3"
        },
        {
            "bufferView": 1,
            "componentType": 5126,
            "count": 555,
            "type": "VEC3"
        },
        {
            "bufferView": 2,
            "componentType": 5126,
            "count": 555,
            "type": "VEC2"
        },
        {
            "bufferView": 3,
            "componentType": 5123,
            "count": 2904,
            "type": "SCALAR"
        }
    ],
    "asset": {
        "generator": "Khronos glTF Blender I/O v5.0.21",
        "version": "2.0"
    },
    "bufferViews": [
        {
            "buffer": 0,
            "byteLength": 6660,
            "byteOffset": 0,
            "target": 34962
        },
        {
            "buffer": 0,
            "byteLength": 6660,
            "byteOffset": 6660,
            "target": 34962
        },
        {
            "buffer": 0,
            "byteLength": 4440,
            "byteOffset": 13320,
            "target": 34962
        },
        {
            "buffer": 0,
            "byteLength": 5808,
            "byteOffset": 17760,
            "target": 34963
        }
    ],
    "buffers": [
        {
            "byteLength": 23568
        }
    ],
    "materials": [
        {
            "doubleSided": true,
            "name": "Material.001",
            "pbrMetallicRoughness": {
                "baseColorFactor": [
                    0.8000074625015259,
                    0.06889203935861588,
                    0.07974385470151901,
                    1
                ],
                "metallicFactor": 0,
                "roughnessFactor": 0.5
            }
        }
    ],
    "meshes": [
        {
            "name": "Suzanne",
            "primitives": [
                {
                    "attributes": {
                        "NORMAL": 1,
                        "POSITION": 0,
                        "TEXCOORD_0": 2
                    },
                    "indices": 3,
                    "material": 0
                }
            ]
        }
    ],
    "nodes": [
        {
            "mesh": 0,
            "name": "Suzanne"
        }
    ],
    "scene": 0,
    "scenes": [
        {
            "name": "Scene",
            "nodes": [
                0
            ]
        }
    ]
}